{
  "id": "footer.bar",
  "layer": "section",
  "category": "FOOTER",
  "purpose": "Legal entity, social and legal links.",
  "sourceComponent": "src/components/Footer.jsx",
  "scrollStops": [
    "footer"
  ],
  "variants": [
    "default"
  ],
  "constraints": {
    "onePerPage": true,
    "required": true,
    "mustBeLast": true
  },
  "contentSchema": {
    "type": "object",
    "additionalProperties": false,
    "required": [
      "copyright",
      "socialLinks",
      "legalLinks"
    ],
    "properties": {
      "copyright": {
        "const": "Copyright © 2025-2026 Nearly Extraterrestrial Technology, Inc."
      },
      "socialLinks": {
        "const": [
          {
            "label": "X",
            "href": "https://x.com/avec"
          },
          {
            "label": "YouTube",
            "href": "https://www.youtube.com/@avecmail"
          },
          {
            "label": "Instagram",
            "href": "https://www.instagram.com/avecmail/"
          },
          {
            "label": "LinkedIn",
            "href": "https://www.linkedin.com/company/avec-ai"
          },
          {
            "label": "hi@avec.ai",
            "href": "mailto:hi@avec.ai"
          }
        ]
      },
      "legalLinks": {
        "const": [
          {
            "label": "Terms of Service",
            "href": "/terms"
          },
          {
            "label": "Privacy Policy",
            "href": "/privacy-policy"
          }
        ]
      }
    }
  },
  "fieldBudgets": {},
  "motion": {
    "pattern": "static",
    "trigger": "none",
    "reducedMotionFallback": "static",
    "durationTokens": []
  },
  "responsive": [
    {
      "query": "max-width:452px",
      "changes": [
        "2-col grid: copyright spans, social col 1, legal col 2"
      ]
    },
    {
      "query": "md",
      "changes": [
        "row, justify-between, py 22px, links gap 24"
      ]
    }
  ],
  "accessibility": [
    "plain anchors"
  ],
  "assetRoles": [],
  "referenceContent": {
    "copyright": "Copyright © 2025-2026 Nearly Extraterrestrial Technology, Inc.",
    "socialLinks": [
      {
        "label": "X",
        "href": "https://x.com/avec"
      },
      {
        "label": "YouTube",
        "href": "https://www.youtube.com/@avecmail"
      },
      {
        "label": "Instagram",
        "href": "https://www.instagram.com/avecmail/"
      },
      {
        "label": "LinkedIn",
        "href": "https://www.linkedin.com/company/avec-ai"
      },
      {
        "label": "hi@avec.ai",
        "href": "mailto:hi@avec.ai"
      }
    ],
    "legalLinks": [
      {
        "label": "Terms of Service",
        "href": "/terms"
      },
      {
        "label": "Privacy Policy",
        "href": "/privacy-policy"
      }
    ]
  },
  "evidenceIds": [
    "ev.src.footer-links",
    "ev.src.footer-copy",
    "ev.src.footer-bar"
  ],
  "notes": "Legal entity name, social handles and legal hrefs are pinned consts (real company data). /terms and /privacy-policy targets were never captured.",
  "generatedAssetRoles": [
    "link.placeholder-url"
  ],
  "generatedContentSchema": {
    "type": "object",
    "additionalProperties": false,
    "required": [
      "copyright",
      "socialLinks",
      "legalLinks"
    ],
    "properties": {
      "copyright": {
        "const": "Copyright © [year] [Company name]"
      },
      "socialLinks": {
        "type": "array",
        "maxItems": 5,
        "items": {
          "type": "object",
          "additionalProperties": false,
          "required": [
            "label",
            "href"
          ],
          "properties": {
            "label": {
              "type": "string",
              "minLength": 1
            },
            "href": {
              "type": "object",
              "additionalProperties": false,
              "required": [
                "assetRole",
                "url"
              ],
              "properties": {
                "assetRole": {
                  "const": "link.placeholder-url"
                },
                "url": {
                  "type": "string",
                  "pattern": "^(#|/[a-z0-9\\-/]*|https://example\\.(com|org|net)(/[A-Za-z0-9\\-/_.]*)?|mailto:[A-Za-z0-9._-]+@example\\.(com|org|net))$"
                }
              }
            }
          }
        }
      },
      "legalLinks": {
        "type": "array",
        "minItems": 1,
        "maxItems": 3,
        "items": {
          "type": "object",
          "additionalProperties": false,
          "required": [
            "label",
            "href"
          ],
          "properties": {
            "label": {
              "type": "string",
              "minLength": 1
            },
            "href": {
              "type": "object",
              "additionalProperties": false,
              "required": [
                "assetRole",
                "url"
              ],
              "properties": {
                "assetRole": {
                  "const": "link.placeholder-url"
                },
                "url": {
                  "type": "string",
                  "pattern": "^(#|/[a-z0-9\\-/]*|https://example\\.(com|org|net)(/[A-Za-z0-9\\-/_.]*)?|mailto:[A-Za-z0-9._-]+@example\\.(com|org|net))$"
                }
              }
            }
          }
        }
      }
    }
  },
  "generatedReferenceContent": {
    "copyright": "Copyright © [year] [Company name]",
    "socialLinks": [
      {
        "label": "Social 1",
        "href": {
          "assetRole": "link.placeholder-url",
          "url": "#"
        }
      },
      {
        "label": "Social 2",
        "href": {
          "assetRole": "link.placeholder-url",
          "url": "#"
        }
      },
      {
        "label": "hello@example.com",
        "href": {
          "assetRole": "link.placeholder-url",
          "url": "mailto:hello@example.com"
        }
      }
    ],
    "legalLinks": [
      {
        "label": "Terms of Service",
        "href": {
          "assetRole": "link.placeholder-url",
          "url": "/terms"
        }
      },
      {
        "label": "Privacy Policy",
        "href": {
          "assetRole": "link.placeholder-url",
          "url": "/privacy-policy"
        }
      }
    ]
  },
  "generatedModeNotes": "Fictional example content for a made-up brand (Foldwell). Every field is original; none is derived from the Avec source.",
  "semantic": {
    "id": "footer.bar",
    "category": "footer"
  },
  "source": {
    "id": null,
    "tag": "div",
    "file": "src/components/Footer.jsx",
    "lines": "61-100",
    "citation": "ev.prov.footer-bar"
  },
  "retrievalEligible": true
}
